{
  "_links": {
    "self": {
      "href": "/organisations/details/corporation-tax?matchId=57072660-1df9-4aeb-b4ea-cd2d7f96e430"
    }
  },
  "taxSolvencyStatus": "V",
  "dateOfRegistration": "2015-04-21",
  "accountingPeriods": [
    {
      "accountingPeriodStartDate": "2018-04-06",
      "accountingPeriodEndDate": "2018-10-05",
      "turnover": 38390
    },
    {
      "accountingPeriodStartDate": "2018-10-06",
      "accountingPeriodEndDate": "2019-04-05",
      "turnover": 2340
    }
  ]
}